{
  "id": "01JA8X3Q7K2M9V5T0N4R6P8W1Y",
  "schema": 1,
  "status": "open",
  "type": "change",
  "author": "Sam",
  "created": "2026-10-09T18:42:11.204Z",
  "environment": "local",
  "url": "http://localhost:5173/checkout?step=2",
  "route": "/checkout",
  "title": "Checkout — Acme",
  "referrer": "http://localhost:5173/cart",
  "userAgent": "Mozilla/5.0",
  "colorScheme": "dark",
  "timezone": "Europe/Amsterdam",
  "viewport": {
    "width": 1440,
    "height": 900,
    "dpr": 2
  },
  "element": {
    "selector": "form#pay > button.primary",
    "text": "Place order",
    "tag": "button",
    "ariaLabel": "Place order",
    "rect": {
      "x": 1102,
      "y": 640,
      "w": 180,
      "h": 44
    }
  },
  "selection": null,
  "screenshot": "screenshot.png",
  "consoleErrors": ["TypeError: x is undefined"],
  "context": {
    "appVersion": "1.4.0-dev",
    "gitSha": "a1b2c3d"
  },
  "tags": [],
  "resolution": null,
  "body": "The place-order button should say \"Start free trial\" and the coupon\nfield should be hidden.\n"
}
